{"session_id":"ses-1","session_state":"ready","execution_target":{"kind":"local","profile":"mac-workstation"},"authority":"local","controller":{"controller_type":"local_user","controller_id":"tomasz.walczuk"},"observed_at":"2026-09-25T12:00:00Z","environment":"mac-dev","source":{"mode":"empty"},"capabilities":{"host_class":"macOS workstation","isolation":"os-user","effective_account":"tomasz.walczuk","service_limits":{"active_sessions":20,"running_commands":4}},"is_stale":false}
