{"session_id":"ses-2","session_state":"busy","execution_target":{"kind":"remote","profile":"linux-host"},"authority":"remote","controller":{"controller_type":"mtls_principal","controller_id":"runner-client"},"observed_at":"2026-09-25T12:01:00Z","environment":"linux-dev","source":{"mode":"git_revision","repository_alias":"runner","requested_revision":"dev","resolved_commit":"0123456789abcdef0123456789abcdef01234567"},"capabilities":{"host_class":"Linux host","isolation":"os-user","effective_account":"ubuntu","service_limits":{"active_sessions":20,"running_commands":4}}}
